{
  "$schema": "http://json-schema.org/draft-07/schema#",
  "$id": "https://autoqa.local/schemas/tool.manifest.schema.json",
  "title": "ToolManifest",
  "description": "Single source of truth describing one test tool plugin. Mirrors scripts/manifests/validate.ts (ToolManifestSchema).",
  "type": "object",
  "additionalProperties": false,
  "required": [
    "schemaVersion",
    "id",
    "alias",
    "title",
    "description",
    "version",
    "enabled",
    "runtime",
    "packageManager",
    "taskfile",
    "projects",
    "compose",
    "tsconfigGen",
    "runner",
    "pipeline"
  ],
  "properties": {
    "$schema": { "type": "string" },
    "schemaVersion": { "const": "1" },
    "id": {
      "type": "string",
      "pattern": "^[a-z][a-z0-9-]+$",
      "description": "Stable identifier; must equal the containing folder name."
    },
    "alias": {
      "type": "string",
      "pattern": "^[a-z][a-z0-9]*$",
      "description": "Short alias used in `task <alias>:run-local`; unique across enabled tools."
    },
    "title": { "type": "string", "minLength": 1 },
    "description": { "type": "string" },
    "version": { "type": "string" },
    "requires": {
      "type": "array",
      "description": "Optional. Host commands this tool needs; the doctor (CLI and Hub) probes them only when the tool is installed.",
      "items": {
        "type": "object",
        "additionalProperties": false,
        "required": ["cmd"],
        "properties": {
          "cmd": { "type": "string", "pattern": "^[A-Za-z0-9._-]+$" },
          "args": {
            "type": "array",
            "items": { "type": "string", "pattern": "^[A-Za-z0-9._=-]+$" }
          },
          "hint": { "type": "string" },
          "optional": { "type": "boolean" },
          "install": {
            "type": "object",
            "additionalProperties": false,
            "description": "Optional. Host package that provides `cmd`, per package manager. Installers read it instead of naming the package themselves.",
            "properties": {
              "scoop": { "$ref": "#/definitions/packageName" },
              "winget": { "$ref": "#/definitions/packageName" },
              "brew": { "$ref": "#/definitions/packageName" },
              "apt": { "$ref": "#/definitions/packageName" }
            }
          }
        }
      }
    },
    "env": {
      "type": "object",
      "description": "Optional. Env defaults every task of this tool needs. Rendered into the generated Taskfile.tools.yml; a value already set in the shell wins. Token {root} is the workspace root.",
      "propertyNames": { "pattern": "^[A-Z][A-Z0-9_]*$" },
      "additionalProperties": { "type": "string" }
    },
    "clean": {
      "type": "object",
      "additionalProperties": false,
      "description": "Optional. What `task clean` removes for this tool.",
      "properties": {
        "paths": {
          "type": "array",
          "description": "Artefact folder names removed anywhere under tools/<id>/ (never inside .venv or node_modules).",
          "items": { "type": "string", "pattern": "^(?!\\.{1,2}$)[A-Za-z0-9._-]+$" }
        },
        "commands": {
          "type": "array",
          "description": "Best-effort shell commands run from tools/<id>/; a failure is ignored.",
          "items": { "type": "string", "minLength": 1 }
        }
      }
    },
    "versionFrom": {
      "type": "object",
      "additionalProperties": false,
      "required": ["file", "dependency"],
      "description": "Optional. Declares where this tool's real version pin lives, so `version` above is regenerated by sync-projects instead of hand-maintained. Omit for a tool installed as a binary (no dependency to read).",
      "properties": {
        "file": {
          "type": "string",
          "minLength": 1,
          "description": "File inside tools/<id>/ carrying the pin, e.g. package.json or pyproject.toml."
        },
        "dependency": {
          "type": "string",
          "minLength": 1,
          "description": "Dependency whose pinned version IS this tool's version, e.g. the test-runner package."
        }
      }
    },
    "enabled": { "type": "boolean" },
    "runtime": { "enum": ["node", "python", "binary"] },
    "packageManager": { "enum": ["pnpm", "uv", "none"] },
    "taskfile": { "type": "string" },
    "projects": {
      "type": "object",
      "additionalProperties": false,
      "required": ["depth", "typeAxis", "fixedType", "templates", "sectionAxis"],
      "properties": {
        "root": { "type": "string", "default": "projects" },
        "depth": { "enum": [1, 2] },
        "typeAxis": { "type": "boolean" },
        "fixedType": { "type": ["string", "null"] },
        "templates": {
          "type": "object",
          "additionalProperties": { "type": "string" }
        },
        "display": {
          "type": "object",
          "additionalProperties": { "type": "boolean" }
        },
        "specsSubdir": { "type": "string", "default": "automations/specs" },
        "sectionAxis": { "type": "boolean" }
      },
      "if": { "properties": { "typeAxis": { "const": false } } },
      "then": { "properties": { "fixedType": { "type": "string" } } }
    },
    "run": {
      "type": "object",
      "additionalProperties": false,
      "description": "Optional run-capability block. Absent resolves to no extra run vars.",
      "properties": {
        "vars": {
          "type": "array",
          "items": {
            "type": "object",
            "additionalProperties": false,
            "required": ["name", "when"],
            "properties": {
              "name": { "type": "string" },
              "when": { "enum": ["sectionAxis", "always"] }
            }
          }
        },
        "headlessVar": {
          "type": "string",
          "description": "Template like 'HEADLESS:{value}' threaded into the command."
        }
      }
    },
    "reports": {
      "type": "object",
      "additionalProperties": false,
      "description": "Optional reports-capability block. Absent resolves to a generic **/*.html listing.",
      "properties": {
        "resultGlob": { "type": "string" },
        "kind": { "type": "string" }
      }
    },
    "tags": {
      "type": "object",
      "additionalProperties": false,
      "description": "Optional tags-capability block. Unknown/absent strategy resolves to 'none'.",
      "properties": {
        "strategy": { "type": "string" }
      }
    },
    "compose": {
      "type": "object",
      "additionalProperties": false,
      "required": ["template", "anchor", "networks"],
      "properties": {
        "template": { "type": "string" },
        "anchor": { "type": "string" },
        "networks": {
          "type": "array",
          "items": { "type": "string", "pattern": "^[a-z][a-z0-9-]*$" }
        },
        "services": {
          "type": "string",
          "minLength": 1,
          "description": "Shared-service compose file relative to the tool folder; the generated root docker-compose.yml includes it."
        }
      }
    },
    "tsconfigGen": {
      "oneOf": [
        { "type": "null" },
        {
          "type": "object",
          "additionalProperties": false,
          "required": ["template", "output", "aliasPrefix", "aliasTarget"],
          "properties": {
            "template": { "type": "string" },
            "output": { "type": "string" },
            "aliasPrefix": { "type": "string" },
            "aliasTarget": { "type": "string" }
          }
        }
      ]
    },
    "docker": {
      "type": "object",
      "additionalProperties": false,
      "description": "Optional and informational. The displayed base image is read from the FROM line of tools/<id>/Dockerfile, else the first image: of the compose template; this value is only the fallback.",
      "properties": {
        "baseImage": { "type": "string" },
        "extras": { "type": "array", "items": { "type": "string" } }
      }
    },
    "runner": {
      "type": "object",
      "additionalProperties": false,
      "required": ["title", "executionTypes", "environments", "steps"],
      "properties": {
        "taskNamespace": {
          "type": "string",
          "pattern": "^[a-z][a-z0-9-]*$",
          "description": "Taskfile namespace; unique across enabled tools. Defaults to alias."
        },
        "title": { "type": "string" },
        "executionTypes": {
          "type": "array",
          "items": {
            "type": "object",
            "additionalProperties": false,
            "required": ["id", "title", "commandTemplate"],
            "properties": {
              "id": { "type": "string" },
              "title": { "type": "string" },
              "commandTemplate": { "type": "string" }
            }
          }
        },
        "environments": {
          "type": "array",
          "items": { "enum": ["local", "docker"] }
        },
        "steps": {
          "type": "array",
          "items": { "$ref": "#/definitions/runnerStep" }
        },
        "commandTemplate": {
          "type": "string",
          "description": "Fallback when no executionType matches. Defaults to task {ns}:{executionType}-{environment}."
        }
      }
    },
    "pipeline": {
      "type": "object",
      "additionalProperties": false,
      "required": ["id", "targetPaths", "envToken", "runCommands", "artifactPaths"],
      "properties": {
        "id": { "type": "string" },
        "targetPaths": {
          "type": "object",
          "additionalProperties": { "type": "string" }
        },
        "envToken": { "type": "string" },
        "runCommands": {
          "type": "object",
          "additionalProperties": { "type": "string" }
        },
        "artifactPaths": { "type": "array", "items": { "type": "string" } }
      }
    }
  },
  "definitions": {
    "packageName": { "type": "string", "pattern": "^[A-Za-z0-9][A-Za-z0-9._+@/-]*$" },
    "passAs": {
      "oneOf": [
        {
          "type": "object",
          "additionalProperties": false,
          "required": ["kind", "key"],
          "properties": {
            "kind": { "const": "task" },
            "key": { "type": "string", "pattern": "^[A-Z][A-Z0-9_]*$" }
          }
        },
        {
          "type": "object",
          "additionalProperties": false,
          "required": ["kind"],
          "properties": { "kind": { "const": "cli" } }
        },
        {
          "type": "object",
          "additionalProperties": false,
          "required": ["kind"],
          "properties": { "kind": { "const": "none" } }
        }
      ]
    },
    "when": {
      "type": "object",
      "additionalProperties": true
    },
    "runnerStep": {
      "oneOf": [
        {
          "type": "object",
          "additionalProperties": false,
          "required": ["kind", "id", "title", "from", "passAs"],
          "properties": {
            "kind": { "const": "selectDirs" },
            "id": { "type": "string" },
            "title": { "type": "string" },
            "from": { "type": "string" },
            "exclude": { "type": "string" },
            "when": { "$ref": "#/definitions/when" },
            "preAction": { "type": "string" },
            "passAs": { "$ref": "#/definitions/passAs" },
            "dockerOverride": { "type": "string" }
          }
        },
        {
          "type": "object",
          "additionalProperties": false,
          "required": ["kind", "id", "title", "choices", "passAs"],
          "properties": {
            "kind": { "const": "select" },
            "id": { "type": "string" },
            "title": { "type": "string" },
            "choices": {
              "type": "array",
              "items": {
                "type": "object",
                "additionalProperties": false,
                "required": ["title", "value"],
                "properties": {
                  "title": { "type": "string" },
                  "value": { "type": "string" }
                }
              }
            },
            "when": { "$ref": "#/definitions/when" },
            "preAction": { "type": "string" },
            "passAs": { "$ref": "#/definitions/passAs" },
            "dockerOverride": { "type": "string" }
          }
        },
        {
          "type": "object",
          "additionalProperties": false,
          "required": ["kind", "id", "title", "passAs"],
          "properties": {
            "kind": { "const": "text" },
            "id": { "type": "string" },
            "title": { "type": "string" },
            "initial": { "type": "string" },
            "when": { "$ref": "#/definitions/when" },
            "preAction": { "type": "string" },
            "passAs": { "$ref": "#/definitions/passAs" },
            "dockerOverride": { "type": "string" }
          }
        }
      ]
    }
  }
}
